{
  "$schema": "https://json-schema.org/draft/2020-12/schema",
  "title": "CCAF flashcards",
  "type": "array",
  "items": {
    "type": "object",
    "additionalProperties": false,
    "required": ["id", "domain", "task_statement", "front", "back"],
    "properties": {
      "id": { "type": "string", "pattern": "^fc-[1-5]\\.[0-9]+-[0-9]{3}$" },
      "domain": { "type": "integer", "minimum": 1, "maximum": 5 },
      "task_statement": { "type": "string", "pattern": "^[1-5]\\.[0-9]+$" },
      "front": { "type": "string", "minLength": 1 },
      "back": { "type": "string", "minLength": 1 },
      "tags": { "type": "array", "items": { "type": "string" } }
    }
  }
}
