[
  {
    "id": "fc-1.1-001",
    "domain": 1,
    "task_statement": "1.1",
    "front": "In the agentic loop, what does a `stop_reason` of `\"tool_use\"` mean, and what should the loop do?",
    "back": "It means Claude is requesting tools. Execute them and iterate — continue the loop.",
    "tags": [
      "stop_reason",
      "agentic-loop",
      "tool_use"
    ]
  },
  {
    "id": "fc-1.1-004",
    "domain": 1,
    "task_statement": "1.1",
    "front": "In the agentic loop, what does a `stop_reason` of `\"end_turn\"` mean, and what should the loop do?",
    "back": "It means Claude has produced its final response. Terminate the loop.",
    "tags": [
      "stop_reason",
      "agentic-loop",
      "end_turn"
    ]
  },
  {
    "id": "fc-1.1-002",
    "domain": 1,
    "task_statement": "1.1",
    "front": "How are tool results incorporated so Claude can reason about the next action?",
    "back": "Keep the assistant's `tool_use` turn in history and append a following user turn containing the matching `tool_result` blocks. This lets the model incorporate the new information into its reasoning on the next iteration.",
    "tags": [
      "tool-result",
      "conversation-history"
    ]
  },
  {
    "id": "fc-1.1-003",
    "domain": 1,
    "task_statement": "1.1",
    "front": "Name the three agentic-loop termination anti-patterns.",
    "back": "1) Parsing natural-language signals (e.g., completion phrases) to decide termination. 2) Using an arbitrary iteration cap as the primary stopping mechanism. 3) Checking assistant text content as a completion indicator instead of `stop_reason`.",
    "tags": [
      "anti-pattern",
      "agentic-loop"
    ]
  },
  {
    "id": "fc-1.2-001",
    "domain": 1,
    "task_statement": "1.2",
    "front": "In a hub-and-spoke multi-agent system, how does work get from the coordinator to the subagents?",
    "back": "The coordinator decomposes the query into subtasks, delegates them to subagents, and dynamically decides which subagents to invoke based on task complexity.",
    "tags": [
      "coordinator",
      "hub-and-spoke",
      "delegation"
    ]
  },
  {
    "id": "fc-1.2-004",
    "domain": 1,
    "task_statement": "1.2",
    "front": "Besides delegating work, what two coordination duties belong solely to the hub, not to subagents?",
    "back": "The coordinator routes ALL inter-subagent communication and error handling (subagents never talk to each other directly), and aggregates subagents' results into the final output.",
    "tags": [
      "coordinator",
      "hub-and-spoke",
      "aggregation"
    ]
  },
  {
    "id": "fc-1.2-002",
    "domain": 1,
    "task_statement": "1.2",
    "front": "Do subagents inherit the coordinator's conversation history or other agents' findings?",
    "back": "No. Subagents run with ISOLATED context. They do not automatically inherit the coordinator's history or other subagents' outputs. Any prior findings a subagent needs (e.g., search results passed to synthesis) must be included explicitly in its prompt.",
    "tags": [
      "isolated-context",
      "context-passing"
    ]
  },
  {
    "id": "fc-1.2-003",
    "domain": 1,
    "task_statement": "1.2",
    "front": "What is the overly-narrow-decomposition failure mode in multi-agent task decomposition?",
    "back": "The coordinator breaks a broad topic into subtasks that only cover part of it (e.g., decomposing \"creative industries\" into digital art, graphic design, and photography while omitting music, writing, film). Subagents then succeed within their narrow scope but the aggregate misses whole domains.",
    "tags": [
      "narrow-decomposition"
    ]
  },
  {
    "id": "fc-1.2-005",
    "domain": 1,
    "task_statement": "1.2",
    "front": "How does a coordinator fix overly-narrow decomposition once it's detected?",
    "back": "Partition scope to span the topic, and run iterative refinement loops that evaluate synthesis for gaps and re-delegate targeted queries to cover what was missed.",
    "tags": [
      "narrow-decomposition",
      "iterative-refinement"
    ]
  },
  {
    "id": "fc-1.3-001",
    "domain": 1,
    "task_statement": "1.3",
    "front": "What must a coordinator's `allowedTools` include to spawn subagents, and what tool actually does the spawning?",
    "back": "The Task tool spawns subagents, and the coordinator's `allowedTools` must include `\"Task\"` for it to invoke them. Without `\"Task\"`, the coordinator cannot delegate and just answers directly.",
    "tags": [
      "task-tool",
      "allowedTools",
      "spawning"
    ]
  },
  {
    "id": "fc-1.3-002",
    "domain": 1,
    "task_statement": "1.3",
    "front": "How do subagents receive the context they need from the coordinator?",
    "back": "Explicitly, in the prompt. Subagents do NOT automatically inherit parent context or share memory between invocations, so the coordinator must include the complete prior findings directly in each subagent's prompt.",
    "tags": [
      "context-passing",
      "no-inheritance"
    ]
  },
  {
    "id": "fc-1.3-003",
    "domain": 1,
    "task_statement": "1.3",
    "front": "How do you spawn multiple subagents in PARALLEL rather than sequentially?",
    "back": "Emit multiple Task calls within a SINGLE coordinator response (not across separate turns). Issuing them across separate turns runs them sequentially instead of concurrently.",
    "tags": [
      "parallel-spawn",
      "task-tool"
    ]
  },
  {
    "id": "fc-1.3-004",
    "domain": 1,
    "task_statement": "1.3",
    "front": "What does an `AgentDefinition` configure for a subagent type?",
    "back": "Each subagent type's description, system prompt, and tool restrictions — the configuration that determines how that subagent type behaves and what it can access.",
    "tags": [
      "AgentDefinition",
      "subagent-config"
    ]
  },
  {
    "id": "fc-1.4-001",
    "domain": 1,
    "task_statement": "1.4",
    "front": "When must you use a programmatic prerequisite gate instead of a prompt instruction for workflow ordering?",
    "back": "When deterministic compliance is required—e.g., identity verification before financial operations. Prompt instructions have a non-zero failure rate, so critical ordering must be enforced programmatically (block the downstream tool until the prerequisite tool has returned).",
    "tags": [
      "programmatic-vs-prompt",
      "deterministic-compliance"
    ]
  },
  {
    "id": "fc-1.4-002",
    "domain": 1,
    "task_statement": "1.4",
    "front": "What belongs in a structured handoff summary when escalating to a human who lacks the conversation transcript?",
    "back": "The decision-ready facts: customer ID, root cause analysis, relevant amounts (e.g., refund amount), and a recommended action—so the human can resolve the case without reading the transcript.",
    "tags": [
      "handoff-protocol",
      "escalation"
    ]
  },
  {
    "id": "fc-1.4-003",
    "domain": 1,
    "task_statement": "1.4",
    "front": "How should an agent handle a customer message containing several distinct problems?",
    "back": "Decompose the request into distinct items, investigate each (often in parallel) using shared context, then synthesize a single unified resolution—rather than handling only the first issue or making the customer resubmit.",
    "tags": [
      "multi-concern-decomposition"
    ]
  },
  {
    "id": "fc-1.5-001",
    "domain": 1,
    "task_statement": "1.5",
    "front": "What does a PostToolUse hook do?",
    "back": "It intercepts a tool's result before the model processes it, letting you inspect or transform that result first.",
    "tags": [
      "PostToolUse"
    ]
  },
  {
    "id": "fc-1.5-004",
    "domain": 1,
    "task_statement": "1.5",
    "front": "What is the canonical use of a PostToolUse hook for MCP tools?",
    "back": "Normalizing heterogeneous formats from different MCP tools (Unix epochs, ISO 8601 strings, numeric status codes) into one consistent representation, so the model never has to reason over mismatched raw values.",
    "tags": [
      "PostToolUse",
      "normalization"
    ]
  },
  {
    "id": "fc-1.5-002",
    "domain": 1,
    "task_statement": "1.5",
    "front": "Hooks vs. prompt instructions: when do you need a hook?",
    "back": "Prompt instructions give probabilistic compliance (raise the odds the model follows a rule). A hook enforces the rule deterministically in code on every call. Choose a hook when a violation has financial, legal, or safety consequences and guaranteed compliance is required; use prompts for soft preferences.",
    "tags": [
      "deterministic-vs-probabilistic",
      "enforcement"
    ]
  },
  {
    "id": "fc-1.5-003",
    "domain": 1,
    "task_statement": "1.5",
    "front": "How should a tool-call interception hook handle a policy-violating action (e.g., a $900 refund over the $500 limit)?",
    "back": "Inspect the outgoing tool call's arguments before execution, block the violating action, and redirect to an alternative workflow such as human escalation. Return a structured result so the model knows what happened, and hand the human reviewer the needed context (customer ID, amount, reason). Do not silently drop it or let it through.",
    "tags": [
      "tool-interception",
      "escalation"
    ]
  },
  {
    "id": "fc-1.6-001",
    "domain": 1,
    "task_statement": "1.6",
    "front": "When do you use a fixed sequential pipeline (prompt chaining) versus dynamic adaptive decomposition?",
    "back": "Prompt chaining: subtasks and their order are predictable and knowable in advance (e.g., per-file review then an integration pass). Dynamic decomposition: open-ended work where subtasks must be generated from what each step discovers (e.g., tracing an unknown outage or auditing a legacy codebase).",
    "tags": [
      "fixed-vs-dynamic",
      "pipeline-selection"
    ]
  },
  {
    "id": "fc-1.6-002",
    "domain": 1,
    "task_statement": "1.6",